{
    "exp": 1458057712,
    "iat": 1458047712,
    "jti": "6a591d32-6a28-4f7d-85c7-27215cc90705",
    "tx_id": "0f534ffc-9442-414c-b39f-a756b4adc6cb",
    "account_service_url": "https://upstream.example.com",
    "case_id": "628256cf-5c78-4896-8bec-f0ddb69aaa11",
    "case_ref": "1000000000000001",
    "case_type": "B",
    "collection_exercise_sid": "789",
    "display_address": "ONS, Segensworth Road",
    "employment_date": "2021-02-01",
    "eq_id": "mbs",
    "form_type": "0253",
    "language_code": "en",
    "period_id": "202101",
    "period_str": "January 2021",
    "ref_p_end_date": "2021-03-01",
    "ref_p_start_date": "2021-01-01",
    "region_code": "GB-ENG",
    "response_expires_at": "2021-11-10T14:06:38+00:00",
    "response_id": "QzXMrPqoLiyEyerrED88AbkQoQK0sVVX72ZtVphHr0w=",
    "ru_name": "ACME T&T Limited",
    "ru_ref": "49900000001A",
    "schema_name": "mbs_0253",
    "trad_as": "ACME T&T Limited",
    "user_id": "64389274239"
}
